{
  "schemaVersion": "1.0",
  "deckId": "why-ppagent-v0.3.0",
  "skinId": "northeastern-university-001",
  "visualLanguage": "继承东北大学模板的蓝白视觉系统与正文安全区，在统一字体、色彩和页眉页脚下，以清晰的方向关系、克制的强调和原生可编辑结构呈现内容。",
  "rhythmStrategy": "以封面和尾页形成边界；中段在顺序推进与双向对照之间切换。五个顺序或因果页面分配带状推进、阶梯推进和横向卡片三种轮廓，相邻页面不重复；文字较长的页面优先使用横向空间更充足的轮廓。",
  "pages": [
    {
      "pageId": "p01",
      "intentId": "why-ppagent-v0.3.0-p01",
      "familyId": "skin-cover",
      "variantId": "default",
      "silhouette": "cover",
      "adaptationStatus": "fixed",
      "reason": "封面只有 Skin 固定候选，直接继承东北大学模板封面，用标题和核心判断建立演示主题。"
    },
    {
      "pageId": "p02",
      "intentId": "why-ppagent-v0.3.0-p02",
      "familyId": "sequential-process",
      "variantId": "ribbon",
      "silhouette": "alternating-ribbon",
      "adaptationStatus": "adaptive",
      "reason": "四项内容沿工作过程推进，带状轮廓能明确先后并把末尾反问作为链路终点；上下交替的正文区也比阶梯卡片更能容纳本页文字。"
    },
    {
      "pageId": "p03",
      "intentId": "why-ppagent-v0.3.0-p03",
      "familyId": "comparison-structure",
      "variantId": "default",
      "silhouette": "balanced-dual-focus",
      "adaptationStatus": "adaptive",
      "reason": "本页只有双向对比候选，左右两组分别承载自由生成与受控生成，并将后者作为重点。"
    },
    {
      "pageId": "p04",
      "intentId": "why-ppagent-v0.3.0-p04",
      "familyId": "sequential-process",
      "variantId": "staircase",
      "silhouette": "ascending-step-path",
      "adaptationStatus": "adaptive",
      "reason": "理解、决定、执行到总结具有明确递进，阶梯轮廓强化职责接续和确定性产出的上升方向；本页文字相对紧凑，适合承担整套中唯一一次阶梯表现。"
    },
    {
      "pageId": "p05",
      "intentId": "why-ppagent-v0.3.0-p05",
      "familyId": "sequential-process",
      "variantId": "horizontal-cards",
      "silhouette": "horizontal-card-chain",
      "adaptationStatus": "adaptive",
      "reason": "场景、工作要求和稳定交付标准是三段逻辑链；横向卡片为较长的要求与标准保留更宽文本区，并与前页阶梯形成轮廓变化。"
    },
    {
      "pageId": "p06",
      "intentId": "why-ppagent-v0.3.0-p06",
      "familyId": "sequential-process",
      "variantId": "ribbon",
      "silhouette": "alternating-ribbon",
      "adaptationStatus": "adaptive",
      "reason": "已有内容、制作缺口、系统介入和生产能力构成四段因果推进；带状轮廓保持方向连续，并避开与相邻第 5 页相同的横向卡片轮廓。"
    },
    {
      "pageId": "p07",
      "intentId": "why-ppagent-v0.3.0-p07",
      "familyId": "sequential-process",
      "variantId": "horizontal-cards",
      "silhouette": "horizontal-card-chain",
      "adaptationStatus": "adaptive",
      "reason": "模板局限、经验提炼和能力形成是三段转化链；本页正文最长，横向卡片提供三种顺序轮廓中更稳定的单项容量，并与前页带状轮廓错开。"
    },
    {
      "pageId": "p08",
      "intentId": "why-ppagent-v0.3.0-p08",
      "familyId": "comparison-structure",
      "variantId": "default",
      "silhouette": "balanced-dual-focus",
      "adaptationStatus": "adaptive",
      "reason": "本页只有双向对比候选，以视觉规范可替换和经验能力可复用两个对象解释首个落地场景与最终边界的区别。"
    },
    {
      "pageId": "p09",
      "intentId": "why-ppagent-v0.3.0-p09",
      "familyId": "skin-closing",
      "variantId": "default",
      "silhouette": "closing",
      "adaptationStatus": "fixed",
      "reason": "尾页只有 Skin 固定候选，用项目使命与价值结论完成收束并回扣封面问题。"
    }
  ]
}
