{
  "schemaVersion": "1.0",
  "deckId": "why-ppagent",
  "skinId": "northeastern-university-001",
  "visualLanguage": "editorial",
  "rhythmStrategy": "alternate-list-and-focus-with-clear-silhouette-differentiation",
  "pages": [
    {
      "pageId": "p1",
      "intentId": "p1",
      "familyId": "skin-body-editorial",
      "variantId": "editorial",
      "silhouette": "editorial-page",
      "adaptationStatus": "adaptive",
      "reason": "并列两个痛点，用editorial-list呈现两个条目"
    },
    {
      "pageId": "p2",
      "intentId": "p2",
      "familyId": "skin-body-editorial",
      "variantId": "editorial",
      "silhouette": "editorial-page",
      "adaptationStatus": "adaptive",
      "reason": "对比两个选项，使用editorial-focus突出固定是优点"
    },
    {
      "pageId": "p3",
      "intentId": "p3",
      "familyId": "skin-body-editorial",
      "variantId": "editorial",
      "silhouette": "editorial-page",
      "adaptationStatus": "adaptive",
      "reason": "三个顺序机制，用editorial-list清晰列出"
    },
    {
      "pageId": "p4",
      "intentId": "p4",
      "familyId": "skin-body-editorial",
      "variantId": "editorial",
      "silhouette": "editorial-page",
      "adaptationStatus": "adaptive",
      "reason": "对比价值，editorial-focus-reverse突出稳定80分"
    },
    {
      "pageId": "p5",
      "intentId": "p5",
      "familyId": "skin-body-editorial",
      "variantId": "editorial",
      "silhouette": "editorial-page",
      "adaptationStatus": "adaptive",
      "reason": "两个并列点，用editorial-list呈现"
    },
    {
      "pageId": "p6",
      "intentId": "p6",
      "familyId": "skin-body-editorial",
      "variantId": "editorial",
      "silhouette": "editorial-page",
      "adaptationStatus": "adaptive",
      "reason": "两个并列点，editorial-focus-reverse保持节奏"
    },
    {
      "pageId": "p7",
      "intentId": "p7",
      "familyId": "skin-body-editorial",
      "variantId": "editorial",
      "silhouette": "editorial-page",
      "adaptationStatus": "adaptive",
      "reason": "总结愿景，editorial-focus突出核心理念"
    }
  ]
}
