{
  "schemaVersion": "1.0",
  "deckId": "liaoning-six-red-education",
  "skinId": "northeastern-university-001",
  "visualLanguage": "editorial-red-accent",
  "rhythmStrategy": "alternate-editorial-and-parallel-cards",
  "pages": [
    {
      "pageId": "shell-cover",
      "intentId": "shell-cover-intent",
      "familyId": "skin-cover",
      "variantId": "default",
      "silhouette": "cover",
      "adaptationStatus": "fixed",
      "reason": "由 cover Shell 固定提供"
    },
    {
      "pageId": "shell-agenda",
      "intentId": "shell-agenda-intent",
      "familyId": "skin-agenda",
      "variantId": "default",
      "silhouette": "agenda",
      "adaptationStatus": "fixed",
      "reason": "由 agenda Shell 固定提供"
    },
    {
      "pageId": "opening",
      "intentId": "opening-intent",
      "familyId": "skin-body-editorial",
      "variantId": "editorial",
      "silhouette": "editorial-page",
      "adaptationStatus": "adaptive",
      "reason": "开场页仅有问候与主题两个短条目，采用编辑式排版以大字突出主题，问候作为引入。"
    },
    {
      "pageId": "from-challenge-to-focus",
      "intentId": "from-challenge-to-focus-intent",
      "familyId": "skin-body-editorial",
      "variantId": "editorial",
      "silhouette": "editorial-page",
      "adaptationStatus": "adaptive",
      "reason": "段落式转变过程，编辑式列表适合按时间顺序呈现。"
    },
    {
      "pageId": "new-matrix",
      "intentId": "new-matrix-intent",
      "familyId": "skin-body-editorial",
      "variantId": "editorial",
      "silhouette": "editorial-page",
      "adaptationStatus": "adaptive",
      "reason": "分层结构但候选无适合的结构化组件，使用编辑式焦点排版突出矩阵框架。"
    },
    {
      "pageId": "practice-levers-1",
      "intentId": "practice-levers-1-intent",
      "familyId": "skin-body-editorial",
      "variantId": "editorial",
      "silhouette": "editorial-page",
      "adaptationStatus": "adaptive",
      "reason": "两个抓手并列，编辑式双陈述排版平衡呈现。"
    },
    {
      "pageId": "practice-levers-2",
      "intentId": "practice-levers-2-intent",
      "familyId": "parallel",
      "variantId": "parallel-cards-p135",
      "silhouette": "equal-width-capability-cards",
      "adaptationStatus": "adaptive",
      "reason": "三个并列实践抓手，卡片结构适合并列展示。"
    },
    {
      "pageId": "five-year-outcomes",
      "intentId": "five-year-outcomes-intent",
      "familyId": "parallel",
      "variantId": "parallel-cards-p135",
      "silhouette": "equal-width-capability-cards",
      "adaptationStatus": "adaptive",
      "reason": "四个成效并列，卡片结构利于对比。"
    },
    {
      "pageId": "conclusion",
      "intentId": "conclusion-intent",
      "familyId": "skin-body-editorial",
      "variantId": "editorial",
      "silhouette": "editorial-page",
      "adaptationStatus": "adaptive",
      "reason": "分层结论，编辑式焦点排版突出最终底色。"
    },
    {
      "pageId": "shell-closing",
      "intentId": "shell-closing-intent",
      "familyId": "skin-closing",
      "variantId": "default",
      "silhouette": "closing",
      "adaptationStatus": "fixed",
      "reason": "由 closing Shell 固定提供"
    }
  ]
}
